,,,MATERIAL SUPLEMENTAR PARA O REDATOR DE CURRÍCULO - NÃO FAZ PARTE DA BNCC,
"Traços, sons, cores e formas",,,,
Campo de experiências,Faixas Etárias,Objetivos de aprendizagem e desenvolvimento,Abordagem das experiências de aprendizagem,Sugestões para o currículo
"Traços, sons, cores e formas",Crianças pequenas (4 anos a 5 anos e 11 meses),"(EI03TS01) 
Utilizar sons produzidos por materiais, objetos e instrumentos musicais durante brincadeiras de faz de conta, encenações, criações musicais, festas.","As crianças pequenas, por meio da música, aprendem sobre si mesmas, seu corpo, sobre os outros e sobre a sua cultura. A música, tradicionalmente, insere as crianças em sua própria cultura e nos ritos que dela fazem parte, como, por exemplo, as canções de aniversário, eventos ou festividades típicas das diversas regiões do país. O desenvolvimento musical das crianças, bem como sua capacidade de se expressar por meio dessa linguagem e aprender sobre sua cultura com ela, são possíveis quando elas estão inseridas em contextos em que as pessoas valorizam, apreciam e fazem uso da linguagem musical. Nesse contexto, é importante que as crianças pequenas tenham experimentos com a produção de sons com fins de “trilha sonora”, que possam participar da composição e escolha desses sons para narrativas, festas etc., que participem de situações em que confeccionem diferentes instrumentos musicais de percussão, de sopro, de corda etc. com materiais alternativos para utilizar em situações de brincadeiras cantadas com outras crianças, que usem seus brinquedos sonoros ou instrumentos musicais para participar de encenações ou criações musicais, vivências de dança etc., e contem histórias usando modulações de voz, objetos sonoros e instrumentos musicais.","Ao formular objetivos de aprendizagem e desenvolvimento específicos para o currículo, é desejável detalhar noções, habilidades, atitudes e/ou especificidades locais para cada um dos objetivos de aprendizagem e desenvolvimento da BNCC. Para as crianças pequenas, é possível construir objetivos específicos relacionados ao fazer musical envolvendo as canções e os instrumentos musicais. Por exemplo, cantar canções conhecidas acompanhando o ritmo com gestos ou com instrumentos musicais ou reconhecer canções características que marcam eventos específicos de sua rotina ou de seu grupo. É possível, também, construir objetivos relacionados à reflexão musical — por exemplo, reconhecer alguns elementos musicais básicos: frases, partes, elementos que se repetem etc. O currículo local pode, ainda, trazer exemplos de manifestações artísticas, canções ou instrumentos de sua região, comunidade, cultura local, nacional ou internacional, além de abordar atitudes a serem desenvolvidas, como apreciar e valorizar a escuta de obras musicais de diversos gêneros, estilos, épocas e culturas, da produção musical brasileira e de outros povos e países."
"Traços, sons, cores e formas",Crianças pequenas (4 anos a 5 anos e 11 meses),"(EI03TS02) 
Expressar-se livremente por meio de desenho, pintura, colagem, dobradura e escultura, criando produções bidimensionais e tridimensionais.","As Artes Visuais são uma linguagem, portanto, uma forma de as crianças pequenas se expressarem e se comunicarem. Por meio de traços, pontos e formas, tanto bidimensionais como tridimensionais, as crianças podem expressar suas ideias, sentidos e sentimentos em uma linguagem que as motiva e as engaja para realizar suas explorações e descobertas sobre as coisas e o mundo à sua volta. Nesse contexto, é importante que as crianças tenham a oportunidade de participar de diferentes situações de aprendizagens — individuais, em pares, trios ou pequenos grupos —, nas quais possam expressar-se, comunicar-se e divertir-se, ao mesmo tempo em que exploram, investigam e fazem descobertas e conexões por meio de desenhos, rabiscos, pinturas, construções, esculturas, colagens, dobraduras etc. Por meio da escuta atenta e das observações do(a) professor(a), é possível organizar situações a partir do interesse das crianças, realizando convites para que façam desenhos de observação, focando nos detalhes e convidando a todos para expor suas produções nos espaços da sala que devem, preferivelmente, estar acessíveis para que possam exibir suas produções com autonomia. É desejável, ainda, promover situações em que as crianças possam construir brinquedos, potes, cestos ou adornos inspirados no artesanato do campo, indígena ou de outras tradições culturais, construir casas ou castelos de cartas, de madeira, de panos e outros materiais, fazer dobraduras simples, bonecas de pano ou de espiga de milho, construir uma estrutura com gravetos, folhas secas, blocos, copos plásticos, embalagens de papelão, experimentar efeitos de luz e sombra sobre objetos ou espaços, com uso de velas ou lanternas, pintar usando diferentes suportes (papéis, panos, telas, pedaços de metal ou acrílico) e materiais (aquarela, tinta guache, tinta feita com materiais da natureza, lápis de cor, canetas hidrográficas, esmalte de unhas), reconhecer a diversidade de padrões de uso das cores em diferentes culturas e contextos de produção e usar esse conhecimento para fazer suas criações no desenho, na pintura etc.","Ao formular objetivos de aprendizagem e desenvolvimento específicos para o currículo, é desejável detalhar noções, habilidades, atitudes e/ou especificidades locais para cada um dos objetivos de aprendizagem e desenvolvimento da BNCC. Para as crianças pequenas, é possível construir objetivos específicos relacionados ao seu fazer artístico, como desenhar e construir produções bidimensionais e tridimensionais ou usar materiais artísticos para expressar suas ideias, sentimentos e experiências. O currículo pode construir objetivos relacionados à sua reflexão sobre o fazer artístico — por exemplo, usar uma variedade de materiais artísticos para se expressar ou utilizar a investigação que realiza sobre o espaço, as imagens, as coisas ao seu redor para significar e incrementar sua produção artística. O currículo local pode, ainda, trazer objetivos relacionados ao conhecimento e à apreciação de produções artísticas de sua cultura ou de outras culturas regionais, nacionais ou internacionais."
"Traços, sons, cores e formas",Crianças pequenas (4 anos a 5 anos e 11 meses),"(EI03TS03) 
Reconhecer as qualidades do som (intensidade, duração, altura e timbre), utilizando-as em suas produções sonoras e ao ouvir músicas e sons.","A criança pequena produz música por meio da exploração do som e de suas qualidades: altura, duração, intensidade e timbre. Elas gostam de explorar, no contato com objetos e instrumentos musicais, os sons agudos e graves (altura), tocar forte ou fraco (intensidade), produzir sons curtos ou longos (duração) e imitar gestos que relacionam com a produção de som. Por meio dessas iniciativas, explorações e manipulações, se apropriam com maior destreza da linguagem musical como forma de expressão e comunicação. Nesse contexto, é importante que as crianças tenham contato com diversos sons de diferentes intensidades, durações, alturas, timbres etc. Esse contato pode se dar por meio de brincadeiras, atividades individuais, em duplas ou pequenos grupos e de situações de exploração dos ambientes à sua volta, procurando objetos e coisas que tenham sons diferentes dos que já conhecem. Dançar conforme a música e as diferentes manifestações sonoras, encontrar movimentos diferentes para expressar cada uma delas, descobrir a reação dos diferentes tipos de som no seu corpo, criar formas de se expressar por meio dos sons que seu corpo emite, que sua voz pode criar, que são possíveis de serem compostos em duplas ou trios são situações que engajam as crianças pequenas em suas descobertas e aprendizagens em relação aos sons.","Ao formular objetivos de aprendizagem e desenvolvimento específicos para o currículo, é desejável detalhar noções, habilidades, atitudes e/ou especificidades locais para cada um dos objetivos de aprendizagem e desenvolvimento da BNCC. Para as crianças pequenas, é possível construir objetivos específicos relacionados ao fazer musical e à produção de sons. Por exemplo, brincar com a música explorando objetos ou instrumentos musicais para acompanhar seu ritmo ou imitar, inventar e reproduzir criações musicais. O currículo pode construir objetivos relacionados com as qualidades do som, como, por exemplo, reconhecer, em situações de escuta de música, algumas características dos sons ou explorar, em situações de brincadeiras com música, variações de velocidade e intensidade na produção de sons. O currículo local pode, ainda, trazer objetivos de aprendizagem e desenvolvimento que ilustrem canções, brincadeiras ou instrumentos musicais que são típicos de sua cultura ou de alguma outra cultura que estão conhecendo."
